{"detectors":{"changepoint":{"best_event_f1":{"test":[[3763009,3763029,1],[3777059,3777079,0],[3825699,3825719,1],[3828369,3828419,0],[3829549,3829569,0],[3829629,3829639,0],[3830479,3830499,0],[3831849,3831879,0],[3831959,3831979,0],[3832749,3832759,0],[3833149,3833179,0],[3833249,3833279,0],[3833479,3833509,1],[3869989,3870099,0],[3898089,3898119,1],[3905359,3905449,0],[3924149,3924179,1],[3949519,3949699,0],[3951509,3951609,0],[3963409,3963689,0],[3995779,3995839,1],[3995909,3995929,1],[4019549,4019579,1],[4022039,4022199,0],[4048019,4048059,0],[4048129,4048159,0],[4048249,4048269,0],[4048349,4048389,0],[4050009,4050129,0],[4050399,4050519,0],[4085809,4085859,1],[4085929,4085949,1],[4113389,4113429,0],[4119169,4119189,0],[4119259,4119289,0],[4119359,4119379,0],[4127169,4127229,0],[4127279,4127299,0],[4127429,4127479,0],[4127519,4127609,0],[4127719,4127799,0],[4127879,4127889,0],[4127929,4127979,0],[4128029,4128089,0],[4132669,4132729,0],[4132769,4132949,0],[4133029,4133049,1],[4135099,4135119,1],[4139009,4139299,0],[4139709,4139969,0],[4141489,4141509,1],[4191589,4191639,0],[4191699,4191739,0],[4191789,4191839,0],[4191889,4191939,0],[4211789,4211819,0],[4227909,4227939,1],[4236029,4236069,1],[4258439,4258449,1],[4258849,4258919,0],[4312779,4312819,1],[4312889,4312919,1],[4320199,4320239,1],[4320929,4320939,1],[4322899,4322939,0],[4341309,4341349,1],[4346999,4347019,1],[4406809,4406859,1],[4446919,4447129,0],[4447219,4447439,0],[4451249,4451259,1],[4491989,4492069,0],[4492199,4492299,0],[4497919,4497939,1],[4525239,4525269,0],[4558279,4558319,1],[4559369,4559439,1],[4561139,4561159,1],[4591199,4591569,0],[4595089,4595349,0],[4595799,4596049,0],[4621559,4621619,1],[4629729,4629739,1],[4690639,4690839,0],[4690919,4691099,0],[4724989,4725049,1],[4730869,4730949,0],[4758799,4758859,1],[4805929,4806109,0],[4806159,4806399,0],[4806579,4806929,0],[4813029,4813039,1],[4855429,4855509,0],[4869739,4869799,1],[4911999,4912019,1],[4916939,4917009,0],[4917049,4917149,1],[4951399,4951469,1],[4961209,4961229,1],[4994419,4994489,1]],"val":[[2505069,2505189,0],[2511189,2511199,1],[2528079,2528129,1],[2533059,2533119,1],[2597949,2598089,0],[2605759,2605769,0],[2714519,2714729,0],[2714789,2714919,0],[2715059,2715169,0],[2715209,2715369,0],[2716809,2716849,1],[2759269,2759379,0],[2759749,2760079,0],[2760159,2760349,0],[2794329,2794379,1],[2821429,2821479,1],[2831189,2831229,1],[2861939,2861949,1],[2874879,2874919,1],[2909009,2909119,0],[2909159,2909249,0],[2909299,2909349,0],[2909409,2909469,0],[2946049,2946209,0],[2946299,2946459,0],[2967059,2967079,1],[2972199,2972239,1],[2974299,2974339,0],[2975179,2975249,0],[2975649,2975699,0],[2979779,2979809,1],[2992419,2992429,0],[2992729,2992749,0],[2992959,2993019,0],[2993359,2993399,0],[3024799,3024829,0],[3024879,3024999,0],[3066929,3066939,1],[3112459,3112579,0],[3112699,3112799,0],[3113399,3113509,0],[3113619,3113819,0],[3116039,3116089,0],[3116159,3116209,0],[3127439,3127449,0],[3129129,3129199,1],[3139349,3139419,0],[3190259,3190279,1],[3195449,3195489,1],[3203909,3204069,0],[3208469,3208599,0],[3218619,3218719,0],[3218759,3218829,0],[3218869,3218919,0],[3218969,3219009,0],[3219069,3219139,0],[3219329,3219429,0],[3219469,3219519,0],[3219719,3219819,0],[3219859,3219899,0],[3220009,3220069,0],[3220109,3220179,0],[3220329,3220509,0],[3259229,3259259,1],[3330739,3330779,1],[3334609,3334659,0],[3373339,3373569,0],[3373669,3373749,0],[3376799,3376849,1],[3425849,3425879,1],[3431859,3431899,1],[3432739,3432769,1],[3459299,3459339,1],[3494959,3494979,1],[3504189,3504439,0],[3510339,3510479,1],[3516849,3516929,0],[3517059,3517339,0],[3564099,3564109,0],[3564199,3564259,0],[3564299,3564369,0],[3564459,3564479,1],[3570519,3570579,0],[3570709,3570789,0],[3645279,3645329,1],[3660749,3660769,0],[3670429,3670449,1],[3673839,3673879,1],[3697459,3697529,0],[3711349,3711359,0],[3711609,3711619,1],[3743479,3743489,1]]},"far_budget_1_per_day":{"test":[[3831859,3831869,0],[3831959,3831969,0],[3833159,3833169,0],[3833249,3833279,0],[3949529,3949669,0],[3951529,3951589,1],[3963419,3963679,0],[3995809,3995829,1],[4022049,4022109,0],[4022179,4022189,0],[4048029,4048059,0],[4048359,4048369,0],[4050019,4050119,0],[4050409,4050519,1],[4085829,4085849,1],[4113399,4113419,0],[4119169,4119189,0],[4119269,4119279,0],[4127179,4127219,0],[4127449,4127469,0],[4127519,4127599,0],[4127729,4127799,0],[4127939,4127979,0],[4128039,4128089,0],[4132669,4132679,0],[4132769,4132829,0],[4132869,4132939,0],[4133029,4133049,1],[4139029,4139249,0],[4139749,4139949,0],[4191599,4191619,0],[4191799,4191829,0],[4191899,4191929,0],[4312799,4312809,1],[4322919,4322929,0],[4406819,4406829,1],[4446919,4447119,0],[4447229,4447429,0],[4492019,4492029,0],[4492199,4492289,0],[4525239,4525259,0],[4558289,4558299,1],[4559389,4559429,1],[4591199,4591559,0],[4595099,4595299,0],[4595819,4596039,0],[4621579,4621589,1],[4690649,4690829,0],[4690919,4691099,0],[4730879,4730929,0],[4805939,4806079,0],[4806219,4806379,0],[4806609,4806919,0],[4869759,4869779,1],[4916959,4917009,0],[4917059,4917149,1],[4951419,4951459,1],[4994429,4994469,1]],"val":[[2505089,2505179,0],[2528089,2528109,1],[2533089,2533109,1],[2598049,2598079,0],[2714539,2714719,0],[2714799,2714899,0],[2715059,2715159,0],[2715219,2715329,0],[2759749,2760069,0],[2760169,2760319,0],[2794329,2794359,1],[2821449,2821459,1],[2909019,2909109,0],[2909159,2909239,0],[2909309,2909339,0],[2909419,2909449,0],[2946049,2946199,0],[2946309,2946449,0],[2972209,2972229,1],[2974309,2974339,0],[2975209,2975229,0],[2975649,2975689,0],[2979789,2979799,1],[2992979,2993019,0],[2993369,2993379,0],[3024889,3024989,1],[3112469,3112569,0],[3112709,3112779,0],[3113409,3113499,0],[3113639,3113789,0],[3116049,3116069,0],[3129139,3129179,1],[3139359,3139409,0],[3203919,3204049,0],[3208489,3208589,0],[3218629,3218709,0],[3218759,3218829,0],[3218879,3218909,0],[3218979,3219009,0],[3219069,3219129,0],[3219339,3219429,0],[3219489,3219509,0],[3219719,3219819,0],[3219859,3219889,0],[3220019,3220069,0],[3220109,3220169,0],[3220339,3220419,0],[3373349,3373559,0],[3373679,3373739,0],[3431859,3431879,1],[3504199,3504439,0],[3510349,3510399,1],[3516859,3516919,0],[3517059,3517329,0],[3564199,3564249,0],[3564299,3564369,0],[3564459,3564469,1],[3570719,3570789,0],[3660749,3660769,0],[3697469,3697519,0],[3711349,3711359,0]]}},"gbm":{"best_event_f1":{"test":[[3776686,3777174,0],[3777211,3777237,0],[3828955,3828957,0],[3878955,3883518,0],[3904880,3905358,0],[3916588,3916589,1],[3918026,3918027,1],[3918416,3918434,1],[3949467,3951502,0],[3960407,3960411,1],[3963349,3963552,0],[3994265,3994339,0],[4022151,4022163,0],[4022580,4022583,0],[4022872,4022874,0],[4022932,4022941,0],[4049948,4050383,0],[4060026,4060108,0],[4060188,4060355,0],[4075556,4075739,0],[4075820,4075862,0],[4090657,4090836,0],[4127044,4128063,0],[4132475,4133031,0],[4138919,4139843,0],[4157645,4157665,0],[4157814,4157840,0],[4191423,4192142,0],[4214280,4214282,1],[4258789,4259013,0],[4318027,4318408,0],[4327141,4327142,0],[4327684,4327738,0],[4327811,4327860,0],[4327939,4327951,0],[4328074,4328075,0],[4328111,4328112,0],[4328160,4328170,0],[4328212,4328220,0],[4328295,4328338,0],[4328481,4328482,0],[4328552,4328553,0],[4328640,4328641,0],[4328706,4328709,0],[4328760,4328769,0],[4328850,4328854,0],[4328904,4328905,0],[4328958,4328959,0],[4329114,4329115,0],[4329329,4329330,0],[4329696,4329697,0],[4329772,4329773,0],[4329872,4329903,0],[4329952,4330001,0],[4330063,4330064,0],[4330198,4330199,0],[4330250,4330251,0],[4330322,4330323,0],[4330379,4330380,0],[4330472,4330473,0],[4330509,4330537,0],[4330577,4330598,0],[4330685,4330686,0],[4330777,4330783,0],[4330865,4330884,0],[4331051,4331052,0],[4331116,4331130,0],[4331188,4331191,0],[4331240,4331271,0],[4331326,4331327,0],[4331422,4331461,0],[4331541,4331559,0],[4331708,4331738,0],[4331798,4331837,0],[4331887,4331919,0],[4331966,4331972,0],[4332049,4332088,0],[4446842,4447382,0],[4456055,4456122,0],[4458518,4458979,0],[4491885,4492189,0],[4524898,4525325,0],[4560352,4560419,0],[4560530,4561073,0],[4579850,4579851,0],[4579944,4579969,0],[4591184,4591333,0],[4594988,4595932,0],[4596869,4596870,1],[4660339,4660340,0],[4660383,4660467,0],[4660502,4660503,0],[4660534,4660535,0],[4660615,4660621,0],[4660664,4660688,0],[4660747,4660748,0],[4690571,4690983,0],[4694686,4694702,0],[4730824,4730830,0],[4730884,4730952,0],[4805864,4806827,0],[4851375,4851382,0],[4851440,4851451,0],[4851488,4851624,0],[4851666,4851671,0],[4851722,4851741,0],[4853426,4853467,0],[4853590,4856335,0],[4869517,4869738,0],[4886004,4886006,0],[4916708,4916789,0],[4916835,4917041,0],[4971977,4972087,0],[4972136,4972165,0],[4972244,4972280,0],[4972880,4972884,0],[4981908,4982408,0]],"val":[[2505400,2505408,0],[2555930,2555931,1],[2556369,2556375,1],[2596678,2596681,0],[2597197,2597249,0],[2597637,2597960,0],[2598107,2598165,0],[2598231,2598755,0],[2599429,2599430,0],[2605381,2605416,0],[2605460,2605479,0],[2605529,2605566,0],[2605607,2605735,0],[2605818,2605852,0],[2616892,2616895,0],[2618337,2618416,0],[2618920,2619224,0],[2621255,2621290,0],[2621359,2621365,0],[2699568,2699571,1],[2714395,2714910,0],[2714963,2715309,0],[2759214,2759220,0],[2759526,2759531,0],[2759740,2759838,0],[2760655,2760656,1],[2765690,2765697,0],[2787864,2787919,0],[2787981,2788022,0],[2788082,2788086,0],[2879657,2880208,0],[2908848,2909462,0],[2945972,2946338,0],[2947887,2947946,1],[2948558,2948559,1],[2948845,2948866,1],[2949192,2949212,1],[2974035,2974090,0],[2974124,2974125,0],[2974161,2974162,0],[2974220,2974386,0],[2974435,2975175,0],[2975217,2975756,0],[2975787,2975796,0],[2975836,2975839,0],[2975886,2976011,0],[2992824,2992825,0],[2993196,2993216,0],[3024493,3024895,0],[3112242,3112424,0],[3112478,3112603,0],[3112638,3112703,0],[3112752,3112835,0],[3113348,3113593,0],[3113660,3113911,0],[3115988,3116076,0],[3141047,3141124,0],[3151546,3151550,0],[3151619,3151633,0],[3151708,3151721,0],[3195428,3195472,1],[3195693,3195737,1],[3196178,3196213,1],[3208567,3208590,0],[3208994,3209